{
    "password": "student",
    "username": "\u0410\u0440\u0442\u0438\u043c\u043e\u0432\u0438\u0447 \u041a\u0438\u0440\u0438\u043b\u043b \u041e\u043b\u0435\u0433\u043e\u0432\u0438\u0447",
    "class": "8\u0410",
    "description": "empty",
    "phone": "+7 702 604 44 12",
    "rights": 1,
    "money": 380,
    "allergies": [
        "\u042f\u0431\u043b\u043e\u043a\u0438"
    ],
    "cart": [
        [
            "14",
            4
        ],
        [
            "11",
            4
        ]
    ],
    "to_take": [],
    "abonement": "\u0417\u0430\u0432\u0442\u0440\u0430\u043a",
    "last_used_day": -1,
    "last_used_hour": -1,
    "last_name": "\u0410\u0440\u0442\u0438\u043c\u043e\u0432\u0438\u0447",
    "first_name": "\u041a\u0438\u0440\u0438\u043b\u043b",
    "middle_name": "\u041e\u043b\u0435\u0433\u043e\u0432\u0438\u0447",
    "class_grade": "8",
    "class_letter": "\u0410",
    "history": [
        {
            "products": [
                "Борщ Московский",
                "Компот Вишневый"
            ],
            "time": "09:15",
            "order_date": "02.02.2026",
            "date": "2026-02-02",
            "money": 0
        },
        {
            "products": [
                "Салат Витаминный",
                "Чай с сахаром"
            ],
            "time": "10:20",
            "order_date": "03.02.2026",
            "date": "2026-02-03",
            "money": 80
        },
        {
            "products": [
                "Апельсин x3"
            ],
            "time": "11:30",
            "order_date": "04.02.2026",
            "date": "2026-02-04",
            "money": 120
        },
        {
            "products": [
                "Суп Кубанский",
                "Салат Средиземноморский"
            ],
            "time": "12:05",
            "order_date": "05.02.2026",
            "date": "2026-02-05",
            "money": 225
        },
        {
            "products": [
                "Рыба запеченная",
                "Чай с сахаром"
            ],
            "time": "13:10",
            "order_date": "06.02.2026",
            "date": "2026-02-06",
            "money": 165
        },
        {
            "products": [
                "Творожная запеканка",
                "Компот Вишневый"
            ],
            "time": "08:45",
            "order_date": "09.02.2026",
            "date": "2026-02-09",
            "money": 130
        },
        {
            "products": [
                "Рис отварной",
                "Салат Грузинский"
            ],
            "time": "14:20",
            "order_date": "10.02.2026",
            "date": "2026-02-10",
            "money": 135
        },
        {
            "products": [
                "Борщ Московский"
            ],
            "time": "09:50",
            "order_date": "11.02.2026",
            "date": "2026-02-11",
            "money": 85
        },
        {
            "products": [
                "Суп Кубанский",
                "Компот Вишневый"
            ],
            "time": "11:15",
            "order_date": "12.02.2026",
            "date": "2026-02-12",
            "money": 0
        },
        {
            "products": [
                "Мясо по-царски",
                "Чай с сахаром"
            ],
            "time": "12:40",
            "order_date": "13.02.2026",
            "date": "2026-02-13",
            "money": 220
        }
    ]
}